{
  "_comment": "Canonical portable bare-name dialect \u2014 the single codegen source of truth (RFC #920). Every binding/engine generates the SAME bare names from this mapping so users learn one reference and assume the rest. Operators are SQL operator symbols; bareName is the portable function name. The mapping is type-agnostic: it applies to EVERY temporal type family. An operator of `positionFamilies`, a position or a topological operator, has instead one name per class of its operands.",
  "provenance": {
    "discussion": "MobilityDB#861",
    "rfc": "MobilityDB RFC #920 (doc/rfc/sql-portability/README.md, branch rfc/sql-portability)",
    "nativePR": "MobilityDB#1075 (1303 operator-overload aliases, each reusing the operator's own C symbol \u2014 identical by construction; CI-gated by tools/portable_aliases/generate.py --check)",
    "manualChapter": "MobilityDB#1078"
  },
  "families": {
    "temporalComparison": [
      { "operator": "#=",  "bareName": "tEqual" },
      { "operator": "#<>", "bareName": "tNotEqual" },
      { "operator": "#<",  "bareName": "tLessThan" },
      { "operator": "#<=", "bareName": "tLessEqual" },
      { "operator": "#>",  "bareName": "tGreaterThan" },
      { "operator": "#>=", "bareName": "tGreaterEqual" }
    ],
    "everComparison": [
      { "operator": "?=",  "bareName": "eEqual" },
      { "operator": "?<>", "bareName": "eNotEqual" },
      { "operator": "?<",  "bareName": "eLessThan" },
      { "operator": "?<=", "bareName": "eLessEqual" },
      { "operator": "?>",  "bareName": "eGreaterThan" },
      { "operator": "?>=", "bareName": "eGreaterEqual" }
    ],
    "alwaysComparison": [
      { "operator": "%=",  "bareName": "aEqual" },
      { "operator": "%<>", "bareName": "aNotEqual" },
      { "operator": "%<",  "bareName": "aLessThan" },
      { "operator": "%<=", "bareName": "aLessEqual" },
      { "operator": "%>",  "bareName": "aGreaterThan" },
      { "operator": "%>=", "bareName": "aGreaterEqual" }
    ],
    "distance": [
      {
        "operator": "<->",
        "bareName": "tDistance"
      },
      {
        "operator": "|=|",
        "bareName": "nearestApproachDistance"
      }
    ],
    "same": [
      {
        "operator": "~=",
        "bareName": "same"
      }
    ]
  },
  "_positionFamiliesComment": "A position or a topological operator has one SQL name per class of its operands, the class followed by the stem: `<<` is setLeft, spanLeft, spansetLeft, tboxLeft, stboxLeft and tpcboxLeft (MobilityDB#2717), `&&` is setOverlaps, spanOverlaps, tboxOverlaps, stboxOverlaps and tpcboxOverlaps (MobilityDB#2930). A temporal operand takes the class of its bounding box. `position` is the stem those names and the MEOS C functions share (left_set_set, overlaps_tspatial_tspatial). The catalog derives the names by class from the @sqlfn tags of the functions whose @sqlop is the operator (`portableAliases.positionNames`).",
  "positionFamilies": {
    "topology": [
      { "operator": "&&",  "position": "overlaps" },
      { "operator": "@>",  "position": "contains" },
      { "operator": "<@",  "position": "contained" },
      { "operator": "-|-", "position": "adjacent" }
    ],
    "timePosition": [
      { "operator": "<<#", "position": "before" },
      { "operator": "#>>", "position": "after" },
      { "operator": "&<#", "position": "overbefore" },
      { "operator": "#&>", "position": "overafter" }
    ],
    "spaceX": [
      { "operator": "<<", "position": "left" },
      { "operator": ">>", "position": "right" },
      { "operator": "&<", "position": "overleft" },
      { "operator": "&>", "position": "overright" }
    ],
    "spaceY": [
      { "operator": "<<|", "position": "below" },
      { "operator": "|>>", "position": "above" },
      { "operator": "&<|", "position": "overbelow" },
      { "operator": "|&>", "position": "overabove" }
    ],
    "spaceZ": [
      { "operator": "<</", "position": "front" },
      { "operator": "/>>", "position": "back" },
      { "operator": "&</", "position": "overfront" },
      { "operator": "/&>", "position": "overback" }
    ]
  },
  "alreadyCanonical": [
    {
      "kind": "functions",
      "functions": [
        "eIntersects",
        "atTime",
        "restriction functions",
        "spatial-relationship functions"
      ]
    }
  ],
  "_explicitBackingComment": "Bare names whose MEOS C family prefix differs from the bare name itself. Verified against the catalog (not guessed): `nearestApproachDistance` is backed by the `nad_*` family (35 functions). Lets the parity audit resolve 100% honestly instead of false-flagging a real, present family.",
  "explicitBacking": {
    "nearestApproachDistance": [
      "nad"
    ]
  },
  "scope": {
    "inScopeTypeFamilies": [
      "temporal",
      "geo",
      "cbuffer",
      "npoint",
      "pose",
      "rgeo"
    ],
    "note": "cbuffer / npoint / pose / rgeo are FULL user-facing temporal types and ARE in scope \u2014 covered like every other type. PR #1075 already aliases all six families (1303 aliases). They must NOT be excluded from any parity headline; an upstream/audit note that 'defers' or 'jointly excludes' them is a known error being corrected \u2014 where another engine defers them, that is incomplete work to close (a gap with a plan), never an accepted exclusion.",
    "deferralIsError": true
  },
  "notes": [
    "Generate aliases by reusing each operator's own backing C function (equivalence by construction), never by reimplementing; mirror MobilityDB tools/portable_aliases/generate.py + its 100%-coverage audit.",
    "User-facing API uses the full name `trgeometry`; internal functions keep the `trgeo_` prefix \u2014 do NOT normalize the internal prefix.",
    "Goal: 100% parity ecosystem-wide \u2014 every operator has its portable name (its bare name, or its name by class for a position or topological operator) on every engine, no gaps, no headline exclusions."
  ]
}
